{
  "bundle": "spa.teaching/0",
  "case_id": "sesiidae-homework-1",
  "case_title": "Sesiidae homework 1: one vocabulary, three readings",
  "comparisons": [
    {
      "case_label": "S. tenuis gland, Japan and Korea",
      "observation_ids": [
        "spa.obs.synanthedon_tenuis.naka_2013.gland",
        "spa.obs.synanthedon_tenuis.yang_2012.gland"
      ],
      "observed_contrast": {
        "a": "Synanthedon tenuis (Japanese population; Toyota City (formerly Fujioka Town), Aichi Prefecture, Japan), gland_extract: detected Z3,Z13-18:OAc [confirmed; major; 2 ng_per_female approximate]; not detected E3,Z13-18:OAc, Z3,E13-18:OAc, E3,E13-18:OAc, E2,Z13-18:OAc, E3,Z13-18:OH, Z3,Z13-18:OH, E2,Z13-18:Al",
        "b": "Synanthedon tenuis (Korean population; Gimhae, Republic of Korea), gland_extract: detected Z3,Z13-18:OH [major]; not detected Z3,Z13-18:OAc [limit 100 pg]"
      }
    },
    {
      "case_label": "S. tenuis, the other population's compound added to each lure",
      "observation_ids": [
        "spa.obs.synanthedon_tenuis.naka_2013.trap_z3z13oh_added.test4_1",
        "spa.obs.synanthedon_tenuis.yang_2012.trap_acetate_added"
      ],
      "observed_contrast": {
        "a": "Synanthedon tenuis (Japanese population; Motosu City, Gifu Prefecture, Japan), field_trapping: Z3,Z13-18:OAc 1000 ug + Z3,Z13-18:OH 100 ug vs Z3,Z13-18:OAc 1000 ug (Z3,Z13-18:OAc alone, 1000 ug); dose 1100 ug: decreased, significant; 4.6 vs 17.0 mean_catch_per_trap (trap_catch, as_reported)",
        "b": "Synanthedon tenuis (Korean population; Gimhae, Republic of Korea), field_trapping: Z3,Z13-18:OH 500 ug + Z3,Z13-18:OAc 50 ug vs Z3,Z13-18:OH 500 ug (Z3,Z13-18:OH alone, 500 micrograms): decreased, not_reported; 0 vs 3.3 mean_catch_per_trap (trap_catch, as_reported)"
      }
    },
    {
      "case_label": "S. tipuliformis, E3,Z13-18:OAc added, Hungary and Tasmania 1986",
      "observation_ids": [
        "spa.obs.synanthedon_tipuliformis.szocs_1990.trap_e3.hungary",
        "spa.obs.synanthedon_tipuliformis.szocs_1990.trap_e3.tasmania_1986"
      ],
      "observed_contrast": {
        "a": "Synanthedon tipuliformis (Kemence, Pest County, Hungary), field_trapping: E2,Z13-18:OAc 100 ug + E3,Z13-18:OAc 3 ug vs E2,Z13-18:OAc 100 ug (E2,Z13-18:OAc alone, 100 micrograms): increased, significant; 40.81 vs 15.38 mean_catch_per_trap (trap_catch, as_reported)",
        "b": "Synanthedon tipuliformis (Huonville, Tasmania, Australia), field_trapping: E2,Z13-18:OAc 100 ug + E3,Z13-18:OAc 3 ug vs E2,Z13-18:OAc 100 ug (E2,Z13-18:OAc alone, 100 micrograms): decreased, significant; 3.24 vs 6.73 mean_catch_per_trap (trap_catch, as_reported)"
      }
    },
    {
      "case_label": "S. tipuliformis, E3,Z13-18:OAc added in Tasmania, 1986 and 2005",
      "observation_ids": [
        "spa.obs.synanthedon_tipuliformis.szocs_1990.trap_e3.tasmania_1986",
        "spa.obs.synanthedon_tipuliformis.suckling_2005.trap_e3.tasmania"
      ],
      "observed_contrast": {
        "a": "Synanthedon tipuliformis (Huonville, Tasmania, Australia), field_trapping: E2,Z13-18:OAc 100 ug + E3,Z13-18:OAc 3 ug vs E2,Z13-18:OAc 100 ug (E2,Z13-18:OAc alone, 100 micrograms): decreased, significant; 3.24 vs 6.73 mean_catch_per_trap (trap_catch, as_reported)",
        "b": "Synanthedon tipuliformis (near Hobart, Tasmania, Australia), field_trapping: E2,Z13-18:OAc 97 parts + E3,Z13-18:OAc 3 parts vs E2,Z13-18:OAc amount not given (E2,Z13-18:OAc alone, same doses (100 and 1000 micrograms)): no_effect, not_significant"
      }
    },
    {
      "case_label": "S. tipuliformis gland content and the six-compound lure",
      "observation_ids": [
        "spa.obs.synanthedon_tipuliformis.mozuraitis_2006.gland",
        "spa.obs.synanthedon_tipuliformis.mozuraitis_2006.trap_six"
      ],
      "observed_contrast": {
        "a": "Synanthedon tipuliformis (Kairėnai near Vilnius, Lithuania), gland_extract: detected E2,Z13-18:OAc [major; 100 relative_to_major as_reported], E3,Z13-18:OAc [minor; 0.7 relative_to_major as_reported], Z13-18:OAc [minor; 2.7 relative_to_major as_reported], E2,Z13-18:OH [minor; 3.2 relative_to_major as_reported], Z13-18:OH [trace], 18:OH [trace]",
        "b": "Synanthedon tipuliformis (Kairėnai near Vilnius, Lithuania), field_trapping: E2,Z13-18:OAc 280 ug + E2,Z13-18:OH 9 ug + Z13-18:OAc 8.5 ug + E3,Z13-18:OAc 2.3 ug + Z13-18:OH 0.1 ug + 18:OH 0.1 ug vs E2,Z13-18:OAc 280 ug + E3,Z13-18:OAc 2.3 ug (binary E2,Z13-18:OAc 280 + E3,Z13-18:OAc 2.3 micrograms): no_effect, not_significant; 19.6 vs 20.8 mean_catch_per_trap (trap_catch, as_reported)"
      }
    }
  ],
  "compounds": [
    {
      "atlas_id": "spa.cmpd.z3_z13_18_oh",
      "inchikey": "QBNCGBJHGBGHLS-NCCHCWSYSA-N",
      "occurrences": [
        {
          "observation_id": "spa.obs.synanthedon_tenuis.naka_2013.gland",
          "roles": [
            "not_detected"
          ]
        },
        {
          "observation_id": "spa.obs.synanthedon_tenuis.yang_2012.gland",
          "roles": [
            "detected"
          ]
        },
        {
          "observation_id": "spa.obs.synanthedon_tenuis.naka_2013.trap_z3z13oh_added.test4_1",
          "roles": [
            "treatment"
          ]
        },
        {
          "observation_id": "spa.obs.synanthedon_tenuis.yang_2012.trap_acetate_added",
          "roles": [
            "treatment",
            "comparator"
          ]
        }
      ],
      "shorthand": "Z3,Z13-18:OH",
      "systematic": null
    },
    {
      "atlas_id": "spa.cmpd.z3_z13_18_oac",
      "inchikey": "VVJPJXKHBZNADP-DNNFRFAMSA-N",
      "occurrences": [
        {
          "observation_id": "spa.obs.synanthedon_tenuis.naka_2013.gland",
          "roles": [
            "detected"
          ]
        },
        {
          "observation_id": "spa.obs.synanthedon_tenuis.yang_2012.gland",
          "roles": [
            "not_detected"
          ]
        },
        {
          "observation_id": "spa.obs.synanthedon_tenuis.naka_2013.trap_z3z13oh_added.test4_1",
          "roles": [
            "treatment",
            "comparator"
          ]
        },
        {
          "observation_id": "spa.obs.synanthedon_tenuis.yang_2012.trap_acetate_added",
          "roles": [
            "treatment"
          ]
        }
      ],
      "shorthand": "Z3,Z13-18:OAc",
      "systematic": null
    },
    {
      "atlas_id": "spa.cmpd.e3_z13_18_oac",
      "inchikey": "VVJPJXKHBZNADP-ZSTZHTMOSA-N",
      "occurrences": [
        {
          "observation_id": "spa.obs.synanthedon_tenuis.naka_2013.gland",
          "roles": [
            "not_detected"
          ]
        },
        {
          "observation_id": "spa.obs.synanthedon_tipuliformis.szocs_1990.trap_e3.hungary",
          "roles": [
            "treatment"
          ]
        },
        {
          "observation_id": "spa.obs.synanthedon_tipuliformis.szocs_1990.trap_e3.tasmania_1986",
          "roles": [
            "treatment"
          ]
        },
        {
          "observation_id": "spa.obs.synanthedon_tipuliformis.szocs_1990.trap_e3.tasmania_1987",
          "roles": [
            "treatment"
          ]
        },
        {
          "observation_id": "spa.obs.synanthedon_tipuliformis.suckling_2005.trap_e3.tasmania",
          "roles": [
            "treatment"
          ]
        },
        {
          "observation_id": "spa.obs.synanthedon_tipuliformis.suckling_2005.trap_e3.new_zealand",
          "roles": [
            "treatment"
          ]
        },
        {
          "observation_id": "spa.obs.synanthedon_tipuliformis.mozuraitis_2006.gland",
          "roles": [
            "detected"
          ]
        },
        {
          "observation_id": "spa.obs.synanthedon_tipuliformis.mozuraitis_2006.trap_six",
          "roles": [
            "treatment",
            "comparator"
          ]
        }
      ],
      "shorthand": "E3,Z13-18:OAc",
      "systematic": null
    },
    {
      "atlas_id": "spa.cmpd.e2_z13_18_oac",
      "inchikey": "NWRSOYAGXTXEMK-NHRIVICHSA-N",
      "occurrences": [
        {
          "observation_id": "spa.obs.synanthedon_tenuis.naka_2013.gland",
          "roles": [
            "not_detected"
          ]
        },
        {
          "observation_id": "spa.obs.synanthedon_tipuliformis.szocs_1990.trap_e3.hungary",
          "roles": [
            "treatment",
            "comparator"
          ]
        },
        {
          "observation_id": "spa.obs.synanthedon_tipuliformis.szocs_1990.trap_e3.tasmania_1986",
          "roles": [
            "treatment",
            "comparator"
          ]
        },
        {
          "observation_id": "spa.obs.synanthedon_tipuliformis.szocs_1990.trap_e3.tasmania_1987",
          "roles": [
            "treatment",
            "comparator"
          ]
        },
        {
          "observation_id": "spa.obs.synanthedon_tipuliformis.suckling_2005.trap_e3.tasmania",
          "roles": [
            "treatment",
            "comparator"
          ]
        },
        {
          "observation_id": "spa.obs.synanthedon_tipuliformis.suckling_2005.trap_e3.new_zealand",
          "roles": [
            "treatment",
            "comparator"
          ]
        },
        {
          "observation_id": "spa.obs.synanthedon_tipuliformis.mozuraitis_2006.gland",
          "roles": [
            "detected"
          ]
        },
        {
          "observation_id": "spa.obs.synanthedon_tipuliformis.mozuraitis_2006.trap_six",
          "roles": [
            "treatment",
            "comparator"
          ]
        }
      ],
      "shorthand": "E2,Z13-18:OAc",
      "systematic": null
    }
  ],
  "espmap": [],
  "observations": [
    {
      "components": [
        {
          "abundance_class": "major",
          "atlas_id": "spa.cmpd.z3_z13_18_oac",
          "detected": true,
          "detection_limit": null,
          "identification": "confirmed",
          "measurements": [
            {
              "qualifier": "approximate",